{
  "recovery": [{
    "cycle_id": 11,
    "sleep_id": "whoop-sleep-synthetic-1",
    "created_at": "2026-07-27T07:00:00Z",
    "updated_at": "2026-07-27T07:00:00Z",
    "score_state": "SCORED",
    "score": {
      "user_calibrating": false,
      "recovery_score": 63,
      "resting_heart_rate": 54,
      "hrv_rmssd_milli": 41.813562
    }
  }],
  "sleep": [{
    "id": "whoop-sleep-synthetic-1",
    "cycle_id": 11,
    "start": "2026-07-26T23:05:00Z",
    "end": "2026-07-27T06:50:00Z",
    "timezone_offset": "+08:00",
    "nap": false,
    "score_state": "SCORED",
    "score": {
      "stage_summary": {
        "total_in_bed_time_milli": 27900000,
        "total_awake_time_milli": 2700000,
        "total_no_data_time_milli": 0,
        "total_light_sleep_time_milli": 14400000,
        "total_slow_wave_sleep_time_milli": 5400000,
        "total_rem_sleep_time_milli": 5400000,
        "sleep_cycle_count": 5,
        "disturbance_count": 3
      },
      "sleep_performance_percentage": 88,
      "sleep_efficiency_percentage": 90.3
    }
  }],
  "cycles": [{
    "id": 11,
    "start": "2026-07-27T00:00:00Z",
    "end": "2026-07-28T00:00:00Z",
    "timezone_offset": "+08:00",
    "score_state": "SCORED",
    "score": { "strain": 12.1, "kilojoule": 4123.5 }
  }],
  "workouts": [{
    "id": "whoop-workout-synthetic-1",
    "start": "2026-07-27T06:00:00Z",
    "end": "2026-07-27T07:00:00Z",
    "timezone_offset": "+08:00",
    "sport_name": "running",
    "score_state": "SCORED",
    "score": {
      "strain": 9.4123,
      "average_heart_rate": 148,
      "max_heart_rate": 171,
      "percent_recorded": 99
    }
  }]
}
